{
  "schemaVersion": 1,
  "commit": "0000000000000000000000000000000000000000",
  "artifacts": [
    {
      "name": "web",
      "digest": "sha256:0000000000000000000000000000000000000000000000000000000000000001",
      "sbomDigest": "sha256:1000000000000000000000000000000000000000000000000000000000000001",
      "provenanceDigest": "sha256:2000000000000000000000000000000000000000000000000000000000000001",
      "mediaType": "application/vnd.oci.image.manifest.v1+json"
    },
    {
      "name": "admin",
      "digest": "sha256:0000000000000000000000000000000000000000000000000000000000000002",
      "sbomDigest": "sha256:1000000000000000000000000000000000000000000000000000000000000002",
      "provenanceDigest": "sha256:2000000000000000000000000000000000000000000000000000000000000002",
      "mediaType": "application/vnd.oci.image.manifest.v1+json"
    },
    {
      "name": "api",
      "digest": "sha256:0000000000000000000000000000000000000000000000000000000000000003",
      "sbomDigest": "sha256:1000000000000000000000000000000000000000000000000000000000000003",
      "provenanceDigest": "sha256:2000000000000000000000000000000000000000000000000000000000000003",
      "mediaType": "application/vnd.oci.image.manifest.v1+json"
    },
    {
      "name": "module-host",
      "digest": "sha256:0000000000000000000000000000000000000000000000000000000000000004",
      "sbomDigest": "sha256:1000000000000000000000000000000000000000000000000000000000000004",
      "provenanceDigest": "sha256:2000000000000000000000000000000000000000000000000000000000000004",
      "mediaType": "application/vnd.oci.image.manifest.v1+json"
    },
    {
      "name": "studio-worker",
      "digest": "sha256:0000000000000000000000000000000000000000000000000000000000000005",
      "sbomDigest": "sha256:1000000000000000000000000000000000000000000000000000000000000005",
      "provenanceDigest": "sha256:2000000000000000000000000000000000000000000000000000000000000005",
      "mediaType": "application/vnd.oci.image.manifest.v1+json"
    },
    {
      "name": "developer-trust-worker",
      "digest": "sha256:0000000000000000000000000000000000000000000000000000000000000006",
      "sbomDigest": "sha256:1000000000000000000000000000000000000000000000000000000000000006",
      "provenanceDigest": "sha256:2000000000000000000000000000000000000000000000000000000000000006",
      "mediaType": "application/vnd.oci.image.manifest.v1+json"
    },
    {
      "name": "automation-browser-worker",
      "digest": "sha256:0000000000000000000000000000000000000000000000000000000000000007",
      "sbomDigest": "sha256:1000000000000000000000000000000000000000000000000000000000000007",
      "provenanceDigest": "sha256:2000000000000000000000000000000000000000000000000000000000000007",
      "mediaType": "application/vnd.oci.image.manifest.v1+json"
    },
    {
      "name": "module-ledger-worker",
      "digest": "sha256:0000000000000000000000000000000000000000000000000000000000000008",
      "sbomDigest": "sha256:1000000000000000000000000000000000000000000000000000000000000008",
      "provenanceDigest": "sha256:2000000000000000000000000000000000000000000000000000000000000008",
      "mediaType": "application/vnd.oci.image.manifest.v1+json"
    },
    {
      "name": "wasi-runner",
      "digest": "sha256:0000000000000000000000000000000000000000000000000000000000000009",
      "sbomDigest": "sha256:1000000000000000000000000000000000000000000000000000000000000009",
      "provenanceDigest": "sha256:2000000000000000000000000000000000000000000000000000000000000009",
      "mediaType": "application/vnd.openopc.linux-service-bundle.v1+zstd"
    },
    {
      "name": "oci-runner",
      "digest": "sha256:0000000000000000000000000000000000000000000000000000000000000010",
      "sbomDigest": "sha256:1000000000000000000000000000000000000000000000000000000000000010",
      "provenanceDigest": "sha256:2000000000000000000000000000000000000000000000000000000000000010",
      "mediaType": "application/vnd.openopc.linux-service-bundle.v1+zstd"
    },
    {
      "name": "desktop",
      "digest": "sha256:0000000000000000000000000000000000000000000000000000000000000011",
      "sbomDigest": "sha256:1000000000000000000000000000000000000000000000000000000000000011",
      "provenanceDigest": "sha256:2000000000000000000000000000000000000000000000000000000000000011",
      "mediaType": "application/vnd.openopc.windows-update-bundle.v1+zstd"
    }
  ],
  "manifestDigest": "sha256:98220404cb0fa25bdeabc97f88ca259366a67f2a813c98dc040a047dc0ac4d1a"
}
